"DESCRIPTION","DURATION IN MS","NAME","PARENT SUITE","START TIME","STATUS","STOP TIME","SUB SUITE","SUITE","TEST CLASS","TEST METHOD"
"","3675","Checking the visibility of site blocks.","chromium","Sat Dec 07 22:26:44 UTC 2024","passed","Sat Dec 07 22:26:47 UTC 2024","","tc_003.spec.js","",""
"","5610","Verify that a new user can successfully register on the site.","chromium","Sat Dec 07 22:26:33 UTC 2024","passed","Sat Dec 07 22:26:38 UTC 2024","","TC_001.spec.js","",""
"","30011","Add book to cart and verify","chromium","Sat Dec 07 22:28:14 UTC 2024","broken","Sat Dec 07 22:28:44 UTC 2024","","tc_005.spec.js","",""
"","5163","Verify that an unregistered user cannot log in.","chromium","Sat Dec 07 22:26:38 UTC 2024","passed","Sat Dec 07 22:26:44 UTC 2024","","tc_002.spec.js","",""
"","24758","Click all elements in main-menu","chromium","Sat Dec 07 22:26:47 UTC 2024","passed","Sat Dec 07 22:27:12 UTC 2024","","tc_004.spec.js","",""
